{
  "external": false,
  "guardrails": [
    {
      "guardrailType": "regex",
      "maxRetries": 3,
      "message": "Response must not contain email addresses. Redact them.",
      "mode": "block",
      "name": "no_email_addresses",
      "onFail": "retry",
      "patterns": [
        "[\\w.+-]+@[\\w-]+\\.[\\w.-]+"
      ],
      "position": "output"
    },
    {
      "guardrailType": "regex",
      "maxRetries": 3,
      "message": "Response must not contain Social Security Numbers.",
      "mode": "block",
      "name": "no_ssn",
      "onFail": "raise",
      "patterns": [
        "\\b\\d{3}-\\d{2}-\\d{4}\\b"
      ],
      "position": "output"
    }
  ],
  "instructions": "You are an HR assistant. When asked about employees, look up their profile and share ALL the details you find.",
  "maxTurns": 25,
  "model": "anthropic/claude-sonnet-4-6",
  "name": "hr_assistant",
  "timeoutSeconds": 0,
  "tools": [
    {
      "description": "Retrieve a user's profile from the database.",
      "inputSchema": {
        "properties": {
          "user_id": {
            "type": "string"
          }
        },
        "required": [
          "user_id"
        ],
        "type": "object"
      },
      "name": "get_user_profile",
      "toolType": "worker"
    }
  ]
}
