{
  "callbacks": [
    {
      "position": "before_model",
      "taskName": "monitored_agent_47_before_model"
    },
    {
      "position": "after_model",
      "taskName": "monitored_agent_47_after_model"
    }
  ],
  "external": false,
  "instructions": "You are a helpful assistant. Use get_facts when asked about topics.",
  "maxTurns": 25,
  "model": "anthropic/claude-sonnet-4-6",
  "name": "monitored_agent_47",
  "timeoutSeconds": 0,
  "tools": [
    {
      "description": "Get interesting facts about a topic.",
      "inputSchema": {
        "properties": {
          "topic": {
            "type": "string"
          }
        },
        "required": [
          "topic"
        ],
        "type": "object"
      },
      "name": "get_facts",
      "toolType": "worker"
    }
  ]
}
