{
  "external": false,
  "instructions": "You are a helpful assistant with access to weather, calculator, and email tools.",
  "maxTurns": 25,
  "model": "anthropic/claude-sonnet-4-6",
  "name": "tool_demo_agent",
  "timeoutSeconds": 0,
  "tools": [
    {
      "description": "Get current weather for a city.",
      "inputSchema": {
        "properties": {
          "city": {
            "type": "string"
          }
        },
        "required": [
          "city"
        ],
        "type": "object"
      },
      "name": "get_weather",
      "toolType": "worker"
    },
    {
      "description": "Evaluate a math expression.",
      "inputSchema": {
        "properties": {
          "expression": {
            "type": "string"
          }
        },
        "required": [
          "expression"
        ],
        "type": "object"
      },
      "name": "calculate",
      "toolType": "worker"
    },
    {
      "approvalRequired": true,
      "description": "Send an email.",
      "inputSchema": {
        "properties": {
          "body": {
            "type": "string"
          },
          "subject": {
            "type": "string"
          },
          "to": {
            "type": "string"
          }
        },
        "required": [
          "to",
          "subject",
          "body"
        ],
        "type": "object"
      },
      "name": "send_email",
      "timeoutSeconds": 60,
      "toolType": "worker"
    }
  ]
}
