{
  "external": false,
  "instructions": "Research the topic and say DONE when you have enough info.",
  "maxTurns": 25,
  "model": "anthropic/claude-sonnet-4-6",
  "name": "researcher",
  "termination": {
    "caseSensitive": false,
    "text": "DONE",
    "type": "text_mention"
  },
  "timeoutSeconds": 0,
  "tools": [
    {
      "description": "Search for information.",
      "inputSchema": {
        "properties": {
          "query": {
            "type": "string"
          }
        },
        "required": [
          "query"
        ],
        "type": "object"
      },
      "name": "search",
      "toolType": "worker"
    }
  ]
}
